{
  "schema_version": "0.1",
  "passport_id": "EP-DEMO-001",
  "created_at": "2026-10-02T13:30:00Z",
  "task": {
    "task_id": "DEMO-001",
    "description": "Reconcile a filing fact and preserve evidence lineage",
    "risk_level": "medium"
  },
  "generator": {
    "agent_id": "sec-xbrl-agent",
    "provider": "demo",
    "model": "reference-implementation",
    "version": "0.1"
  },
  "sources": [
    {
      "source_id": "SRC-001",
      "uri": "https://www.sec.gov/",
      "retrieved_at": "2026-10-02T13:25:00Z",
      "sha256": "demo-source-hash"
    }
  ],
  "claims": [
    {
      "claim_id": "CLM-001",
      "text": "Demonstration claim only; no empirical assurance is asserted.",
      "status": "UNRESOLVED",
      "evidence_refs": [
        "SRC-001"
      ]
    }
  ],
  "calculations": [],
  "reviews": [
    {
      "review_id": "REV-001",
      "reviewer_agent": "independent-reviewer",
      "role": "reviewer",
      "verdict": "UNRESOLVED",
      "notes": "Example structure only."
    }
  ],
  "conflicts": [],
  "human_approval": {
    "required": true,
    "status": "pending",
    "approver": null,
    "approved_at": null
  },
  "final_status": "DRAFT",
  "content_sha256": "691d99a52e88d364845c74c462e56091b0014de552c6e41107501a2b6567e3c4"
}
